{
  "authorization_token_hash": "sha256:c068af08f32c622a3d488553244444af4641cd0b1c66ca16496032c62bf13227",
  "biometric_event": {
    "tee_attestation": "eyJhbGciOiJFUzI1NiJ9.eyJhdHRlc3RhdGlvbiI6InRlc3QifQ.c2ln",
    "timestamp": "2026-08-18T14:23:08Z",
    "type": "FIDO2_BIOMETRIC"
  },
  "consumer_device_id": "dev_9f3a1c2e4b5d6f7a8b9c0d1e2f3a4b5c",
  "participation_state": "EXPANDED_SCOPE",
  "session_id": "sess_2e4f6a8c0b2d4f6a",
  "signature": "MEQCIClUkfmTdiu9q7cdaQq2hB9MP8S6WXYo4AEUYIdhEyF5AiAF8PIEa0JbasSzMtetcvDHygLfGyjxzq9BEiHNSnmkAg==",
  "temporal_validity": {
    "not_after": "2026-08-18T15:23:08Z",
    "not_before": "2026-08-18T14:23:08Z"
  },
  "token_type": "AFSP_SCOPE_EXPANSION",
  "version": "0.1"
}
